贴文ID,作者名字,认证状态,粉丝数,转评赞数,微博内容,话题名称,视频标题
P9moFDK1X,寰球探索君,True,158878,761717,从死对头到热聊：唐纳德·特朗普奥巴马葬礼上的10秒对话说了啥？ #寰球探索君[超话]# #美国大选# #奥巴马# #特朗普在卡特葬礼上与奥巴马交谈# http://t.cn/A6u3hdK6 ,美国大选/奥巴马/特朗普在卡特葬礼上与奥巴马交谈,寰球探索君的微博视频
OBbLIyQjb,参考消息,True,24515472,38207052,#奥巴马嘲讽特朗普团队只会指责移民#【奥巴马嘲讽特朗普团队：无论你问啥 他们只会指责移民】据美媒报道，10月10日，美国前总统奥巴马猛烈抨击特朗普团队，称当特朗普、万斯被问及如何解决美国住房、医疗、教育等问题时，他们唯一的答案就是指责移民。 http://t.cn/A6ERBxoO ,奥巴马嘲讽特朗普团队只会指责移民,参考消息的微博视频
Ozl8EpKCj,今日俄罗斯RT,True,1968258,24562984,【#奥巴马获诺贝尔和平奖遭哥哥质疑#：“他甚至无法和我和平相处”】近日，美国前总统奥巴马同父异母的哥哥马利克·奥巴马在接受RT采访时表示，他对奥巴马为何成为诺贝尔和平奖获得者感到困惑。他称，“奥巴马担任总统期间，全世界都乱套了，中东都处于混乱状态，利比亚乱成一团。他甚至无法和我和平相 ,奥巴马获诺贝尔和平奖遭哥哥质疑,今日俄罗斯RT的微博视频
OlcQorO23,华商报,True,11252741,29796698,【#拜登承认首场辩论表现不佳# 但表示不会退出总统竞选 #奥巴马发声力挺拜登#：糟糕的辩论表现是会发生的】当地时间周五，美国总统拜登表示，虽然辩论表现确实不佳，但他不会退出11月的总统选举，将继续捍卫民主。  此前一天，拜登与前总统特朗普进行了首场总统候选人电视辩论。而他灾难性的表现实在令 ,拜登承认首场辩论表现不佳/奥巴马发声力挺拜登,华商报的微博视频
O9Ntv0Eq4,拾光长河,True,154849,540180,美国总统奥巴马演讲《你为什么要好好学习》完整版，虽然美国如今在世界上的嚣张作风是我们应该坚决反对的，但这位前美国总统的这番演讲还是值得我们好好听听的。 http://t.cn/A6TOSxoT ,,拾光长河的微博视频
O5DhKsMpZ,寰亚看世界,True,379332,3868182,#奥巴马现身唐宁街#美国前总统奥巴马前往英国伦敦唐宁街10号，参加一场未公开的私人会议。 http://t.cn/A6T7VWqP ,奥巴马现身唐宁街,寰亚看世界的微博视频
OBVzDAOCQ,云长知本,True,163879,591177,拜登退出竞选之后和奥巴马罕见在公开场合见面，参加肯尼迪夫人的葬礼，对话耐人寻味，有人录下来了。[哈哈][哈哈][哈哈] http://t.cn/A6EgwBkw ,,云长知本的微博视频
OBcyqvHEu,参考消息,True,24515472,38207052,#特朗普称民主党对他进行政治迫害#【奥巴马：特朗普就是个笨手笨脚 自私的亿万富翁 特朗普：民主党迫害我】#奥巴马斥特朗普是又笨又自私的亿万富翁# 据美媒报道，10月10日，美国前总统奥巴马猛烈抨击特朗普，称其是一个只考虑自己的亿万富翁。我们不需要再有四年的傲慢、笨手笨脚和虚张声势，美国已 ,特朗普称民主党对他进行政治迫害/奥巴马斥特朗普是又笨又自私的亿万富翁,参考消息的微博视频
OEB9JlDpL,_叶抱一,True,303021,4153314,奥巴马也彻底疯狂！#美国大选# http://t.cn/A6nas4rX ,美国大选,_叶抱一的微博视频
NuFo0yq9I,随笔视频,True,930804,21055508,奥巴马2022年演讲：你只要用垃圾信息搅乱一个国家的舆论场，提出足够多的问题，散布足够多的谣言，植入足够多的阴谋论，让这些国家的公民不知道该相信什么，一旦他们对自己的国家失去信任，不再相信主流媒体，人民不再相互信任，不再相信会有真理，我们就赢了。 http://t.cn/A6Wsv8Sn ,,随笔观澜的微博视频
OCToW3rqV,宋忠平,True,10539303,2921216,美福音派给特朗普发功，奥巴马猪队友搞道德绑架，美大选变数大#烽火问鼎计划# #美国2024年总统大选# http://t.cn/A6nAyChE ,烽火问鼎计划/美国2024年总统大选,宋忠平的微博视频
OxQXx3B4g,美国驻华大使馆,True,3524146,47298489,#伯恩斯大使的民主对话#  在今天的视频中，朱棣文教授和伯恩斯大使回顾他担任能源部部长期间，与当时的商务部部长骆家辉为清洁能源一同访华。朱棣文和骆家辉当时都是奥巴马内阁的华裔成员，骆家辉后来还出任美国驻华大使，成为美国历史上首位华裔驻华大使。 http://t.cn/A6EZUwxr ,伯恩斯大使的民主对话,美国驻华大使馆的微博视频
OC6zMC0vr,-书剑舞-,True,175149,1020832,今晚，特朗普出席了艾尔·史密斯的晚宴，并发表了讲话。坐在他左边的，就是民主党大佬舒默，坐在他右前方的，就是是民主党的真正传媒大佬，宣传部长，现在彭博集团的老板，纽约前市长，布隆伯格。 今晚，哈里斯，奥巴马夫妇，拜登夫妇，佩洛西，克林顿夫妇，都没有出席这场名流晚宴，所以民主党的代表， ,,#NAME?
OENT2v4UF,羊又走丢了,True,5872776,18031580,美国大选如此疯狂，“政商娱”圈三界大混战，惊天猛料让人不寒而栗！  萝莉岛，吹牛老爹，马斯克 ，霉霉，复仇者联盟，全员上阵……[允悲][揣手]  #特朗普与哈里斯继续决战摇摆州##特朗普抱怨奥巴马给他留下烂摊子# http://t.cn/A6nK4EoZ ,特朗普与哈里斯继续决战摇摆州/特朗普抱怨奥巴马给他留下烂摊子,羊又走丢了的微博视频
OBknnsnbq,福可观点,True,1175631,16857282,美国黑人对奥巴马怂恿黑人群体投票给哈里斯的回应 这种口音就知道是受过教育的!!!!#美国大选# http://t.cn/A6EnGGIc ,美国大选,福可观点的微博视频
OaQHwgOeV,衝鋒号角,True,919411,22934534,到底谁才是美国现任总统？  集会上，拜登如同奥巴马的提线木偶。 http://t.cn/A6TRNd6n ,,衝鋒号角的微博视频
OB3JXoD6v,微天下,True,47204323,153976959,【#奥巴马登场为哈里斯拉票并批特朗普#】10月10日，奥巴马首次作为战场州代理人参与2024年美国大选，批评特朗普。奥巴马称特朗普针对美国飓风说谎，并嘲笑他与美国普通人的生活脱节。奥巴马还在发言中为哈里斯拉票，此前奥巴马夫妇已表态支持哈里斯。目前特朗普方面暂未对奥巴马这一发言作出回应。但此 ,奥巴马登场为哈里斯拉票并批特朗普,世面的微博视频
Otv9Rza2w,童鞋的利剑_777,False,221334,1043810,特朗普称巴拉克·侯赛因·奥巴马向普京提供高超音速导弹制造计划犯有叛国罪  “有人把我们所有的高超音速导弹计划都交给了俄罗斯……他们建造了它们，而我们没有。”  观众席中有人大喊“比尔·克林顿”……特朗普回应道 ——“可能是巴拉克·侯赛因·奥巴马，也许我们应该问问他。”??  我向你打赌，这不 ,,童鞋的利剑_777的微博视频
OncOmoE1L,今日俄罗斯RT,True,1968258,24562984,【#RT玩梗#奥巴马上演#白人握手黑人抱抱#】近日，美国前总统奥巴马无意复现了网络名梗：“白人握手黑人抱抱”。 http://t.cn/A6QdCGaD ,RT玩梗/白人握手黑人抱抱,今日俄罗斯RT的微博视频
O728UCpRe,低级黑小明,False,198168,380280,美国球形韦德的变性儿子跟奥巴马老公连线，请教做好变性人的建议，很明显大麦克显得很尴尬，并且略有不爽。 背景说明：奥巴马老公米歇尔是变性人，鸡鸡还没割，是个男人，他们俩是同性恋，女儿是领养的 http://t.cn/A6TqPS3e ,,低级黑小明的微博视频
Oj8j4iTs2,兰斌强,True,279642,2187922,#专家# 【专家再次发表“高论”】美国对中国多么“善良”——给中国“忠告”把这位专家感动了!2010年时任美国总统奥巴马就对中国提出过比这还要“善良”的“忠告”——奥巴马不许中国人过美国般的日子，否则世界无法承受! http://t.cn/A6QAVFVd ,专家,兰斌强的微博视频
OB2H8AnIa,寰球探索君,True,158878,761717,美国前总统贝拉克·侯赛因·奥巴马在宾州 East Liberty 街区举行的黑人选民支持哈里斯的活动上发表了“强硬讲话”。他指出：  “黑人男性对哈里斯的热情不如他第一次竞选总统时对他的热情，他试图鼓励他们加入支持哈里斯的运动。”（via：Ryan Deto）#寰球探索君[超话]##美国大选##奥巴马#  ,美国大选/奥巴马,寰球探索君的微博视频
OEyj3ihDL,伯阳先生-段本司,True,318863,6923235,作为名人真的不能随便和人合影  因为你的合影不一定会被对方拿去搞什么故事  我相信董明珠、陈光标纯属躺枪  倪萍应该也不会是他的客户  尤其陈光标这种老油条更不会  至于联合国秘书长甚至奥巴马们  他们的合影都是明码标价的  中美贸易战之前，奥巴马在上海的合影是五十万一张  [黑线][黑线][黑线] ,,伯阳先生-段本司的微博视频
OBdKlcn6c,冒个大泡泡2024,True,48695,187558,奥巴马在东自由区举行的黑人选民支持哈里斯活动中发表了“强硬言论”。他表示，黑人男性对哈里斯的热情不如他第一次竞选时那么高。  看来选情不如精英们的预期啊……  看得出来，奥八有点急了，慌不择路了。他以前至少很会伪装，但一开口就赤裸裸地挑动族群对立，要求黑人兄弟都投票给同样是黑人的哈里 ,,冒个大泡泡2024的微博视频
OvKtkjtRt,李大柱之冠,True,325764,2686824,美国前总统奥巴马的演讲：  “我们不应该是世界警察。”  老马这感染力还是很强的， http://t.cn/A6RYZvvM ,,李大柱之冠的微博视频
ODwI4yoLh,江南小蝶52,False,134618,280555,#奥巴马妻子称投特朗普是反对女性#难道伪装成女性就是支持女性吗？[思考] http://t.cn/A6nqzPSt ,奥巴马妻子称投特朗普是反对女性,江南小蝶52的微博视频
OyaGD2eie,-四分三十三秒-,True,7663103,42458921,#美国拨款16亿美元雇水军黑中国#2022年奥巴马演讲谈美国如何干预他国舆论。 http://t.cn/A6E20Ycy ,美国拨款16亿美元雇水军黑中国,#NAME?
O18zduonH,朱伟老师,True,5192206,24025170,奥巴马“求职面试”视频，真是一枚被总统事业耽误的网红！[笑cry][笑cry][笑cry]  #决战考研# #考研复试# #考研[超话]# http://t.cn/A6YXkasz ,决战考研/考研复试,朱伟老师的微博视频
O3pHa1xZb,镜子杂谈,True,706740,2639719,记者采访川粉，结果晕掉了。  记者先问标语啥意思？Trump 24 Or Before确实费解。  女川说意思是特郎普还是总统，记者还强调说那是说现在特朗普才是总统吗？  女川说我就信这个。  记者说拜登已经是总统了啊。  女川突然转向，说奥巴马才是总统，是在背后发号施令的家伙，麻烦都是奥巴马造成的啦。  记 ,,镜子杂谈的微博视频
ODCECuJDT,买家张俊,True,1519844,6672876,#奥巴马妻子称投特朗普是反对女性# 美国大选就差最后一哆嗦了，目前哈里斯和特朗普的支持率都在48%左右。  米歇尔·奥巴马近日在密歇根州的集会上公开支持哈里斯，她强调，投票给特朗普等同于反对女性的权利和价值。她以母亲的身份呼吁选民，尤其是男性，要认识到特朗普对女性健康的威胁，以及对女性权 ,奥巴马妻子称投特朗普是反对女性/美国大选,买家张俊的微博视频
P5H9e6YJS,墨林金论,True,109941,300172,中央情报局在与巴拉克·奥巴马竞选时非法间谍唐纳德·特朗普，现在是重新分享这一点的最佳时机：  主流报道巴拉克·奥巴马间谍国会、记者、唐纳德·特朗普、数百万美国人等......?? http://t.cn/A6mF80zW ,,墨林金论的微博视频
Oi9cVtAmv,英语演讲精华,True,226467,633025,【奥巴马在罗格斯大学演讲：无知绝非美德】他在演讲中说到“信息的泛滥并没有让我们对真相有更多的辨别力，在某些方面，它只是让我们对自己的无知更有信心。”所以，未知全貌，不予置评。  #英语演讲精华# http://t.cn/A62hUCa3 #演讲精华# #VOAEC精选[超话]# #TED演讲# ,英语演讲精华/演讲精华/TED演讲,新通雅思在线的微博视频
P8Ugu3Y4U,Joken是个runner,True,162154,860915,Daily Show调侃川普和奥巴马在卡特的葬礼上聊天#卡特葬礼上美国前总统上演修罗场# http://t.cn/A6u8QcN7 ,卡特葬礼上美国前总统上演修罗场,Joken是个runner的微博视频
P7AMc6a5u,凤凰卫视,True,14933817,29246784,【拜登任内最后一次出访 为何选择梵蒂冈和意大利？】白宫新闻秘书让-皮埃尔日前表示，美国总统拜登将于1月9日至12日出访梵蒂冈和意大利。期间，拜登计划于10日会见教皇方济各，并将与意大利总理梅洛尼和总统马塔雷拉举行会谈。有分析指，此行是拜登任内、也是其政治生涯中的最后一次出访。  北京外国语 ,新闻今日谈,凤凰卫视的微博视频
Onuy86vSe,盖世英雄玉椒龙,True,409207,30634421,#奥巴马就特朗普遭枪击发声#   当年如果不是奥巴马说特朗普绝对不可能成为总统，特朗普还不一定选总统呢#特朗普称右耳被子弹击穿##特朗普称右耳被子弹击穿# http://t.cn/A6QD97t5 ,奥巴马就特朗普遭枪击发声/特朗普称右耳被子弹击穿,盖世英雄玉椒龙的微博视频
O5pvVeOhw,孤烟暮蝉,True,7355083,231283226,前中央情报局特工表示：“奥巴马医改是为了拐卖儿童。  当他输入代码的那一刻，儿童贩运者就开始跟踪那位怀孕的母亲。  他们会跟随孩子度过了学校的最初几年，他们知道它是否有金发蓝眼睛。”（来源:X原推特） http://t.cn/A6TPJKPI ,,孤烟暮蝉的微博视频
ODEvBeunM,续写蓝精灵的故事,True,154967,636016,#哈里斯和特朗普民调结果不相上下#奥巴马为哈里斯拉票，调侃特朗普卖货筹款：特朗普号称对中国很强硬，但一到赚钱的时候就忘了！网友:无论谁当选，对兔子的政策都没什么好的[笑cry]#美国大选# http://t.cn/A6n5HWBr ,哈里斯和特朗普民调结果不相上下/美国大选,续写蓝精灵的故事的微博视频
P95U6vXbq,两仪生麻瓜,True,252421,2265536,美国唇语专家网友给奥巴马和特朗普配了台词  美国为什么拿俄罗斯没办法，就是因为去了手里有能源，即便被制裁两三年，照旧打俄乌战争不妥协。  特朗普上台也想做能源出口国，最好的方式是多给美国搞点能源，于是加拿大、格陵兰岛、墨西哥湾都要纳入麾下。  也体现了特朗普依然蛮幼稚的。  ,,两仪生麻瓜的微博视频
OD13kCUfP,Mkuag,True,123215,806150,奥巴马： 这是我向年轻人传达的信息：你不会让一群老年人决定你要听什么音乐或你要穿什么衣服——所以不要让他们决定你的未来。  http://t.cn/A6n2KBOe ,,Mkuag的微博视频
OEJRNxtCq,总台环球资讯,True,48684809,45147335,【视评线 | #美国大选5任总统大乱斗#】#美国大选#进入冲刺阶段，然而，五任总统却开启“大乱斗”模式：最初参选的两位总统——拜登和特朗普，前者出局了但没完全出局，后者因遭暗杀而差点物理出局；奥巴马、克林顿和卡特三位前总统也进场搅局，硬生生开启一场“五王之战”……这届美国大选的混乱程度， ,美国大选5任总统大乱斗/美国大选,央视新闻的微博视频
OFqNFbIyu,空警世界,True,8553086,8202915,特朗普当年胜选后，赛车传奇人物Mario Andretti说他想开车送川普去见奥巴马，坐他的车能快一点到达白宫。于是就有了这个视频。 http://t.cn/A6nl9PVB ,,空警世界的微博视频
OtinOkbiY,西雅图夏至,True,378356,3493701,Obama：将决定选举结果的人，都会考虑一个问题～谁在为我争取一个更好的未来？ Trump肯定不关心这个问题，九年前乘金电梯降临那一刻起，这个七十多岁的富豪一直在抱怨他自己的问题，不满和牢骚喋喋不休，现在怕输给Harris，问题好像更严重了，幼稚地起外号、疯狂地编阴谋论、怪异地痴迷于“人群大小” ,,西雅图夏至的微博视频
O7dThcYOp,云长知本,True,163879,591177,川普在纽约参加被杀警察的葬礼，拜登和克林顿、奥巴马一起也在纽约，参加筹款活动预计筹款2500万美元。 http://t.cn/A6T50q3r ,,云长知本的微博视频
OETET3IWF,胭脂泪叹,True,514286,1074585,【中英字幕】崔娃预想贺锦丽当选总统难度堪比游戏闯关  崔娃最近在喜剧地下室的单口喜剧小段，他提到了正在如火如荼展开的2024年美国总统大选，台下很多观众在为贺锦丽呐喊欢呼。对此，他预想道，贺锦丽如果想要胜选没有那么容易，与之相比，奥巴马作为黑人当选其实只相当于《超级马里奥兄弟》的第一关 ,综艺二创榜,胭脂泪叹的微博视频
OEQc9fATV,评点一哥,True,394936,9533402,奥巴马痛批特朗普:他发财是靠他爸给的4亿美元，但公司还是破产6次 http://t.cn/A6nKmbhM ,,评点一哥的微博视频
OuujuePkN,老王谈改革,True,174439,1138233,【现在回头看2009年时的中美关系：此去经年，恍如隔世】在奥巴马2009年第一次访问中国之前，美国学界与智库盛行“中美国”、“G2”概念，意即主张美国与中国共治世界。美方在奥巴马访华前炒作到高潮，意思是要中方“接绣球”。当时国内媒体对此的反应：1）不怀好意；2）另有图谋；3）想让中国改变颜色 ,,老王谈改革的微博视频
NxTh8rQOY,VOA英文口语,True,4352451,28471871,【奥巴马成名演讲：无畏的希望】这是奥巴马在美国民主党全国代表大会上的主题演讲，是令奥巴马从美国一个州（伊利诺伊州）走向白宫的一次具有里程碑意义的重要演讲。演讲取得了巨大成功，为他的地位奠定了坚实的基础，也为其以后的大选奠定了基础。http://t.cn/EUZgrId ,,学点英语口语的秒拍视频
NDDi9k6J3,小菌评论,True,4113885,5557859,2009年奥巴马访华，参观长城真实画面。大批黑衣人贴身保护 http://t.cn/A6ja4PAn ,,小菌评论的微博视频
OEIgE3aF1,参考消息,True,24515472,38207052,#特朗普抱怨奥巴马给他留下烂摊子#【特朗普抱怨：奥巴马留给我一个烂摊子 我那么尊重他妻子 她也来攻击我】#特朗普不满遭奥巴马妻子攻击# 据美媒报道，11月3日，美国前总统特朗普抱怨前总统奥巴马，他留给我一个烂摊子，我那么尊重他妻子，他妻子最近也来攻击我。#美国大选5任总统大乱斗#  ,特朗普抱怨奥巴马给他留下烂摊子/特朗普不满遭奥巴马妻子攻击/美国大选5任总统大乱斗,参考消息的微博视频
OEOnLxiC5,新浪军事,True,50229921,77386584,【#特朗普叫屈德国人不喜欢他#】据德新社11月3日报道，美国前总统特朗普在11月3日的竞选活动中谈到他与德国之间的困难关系。这位共和党总统候选人在宾夕法尼亚州利蒂茨说：“他们不喜欢我，而我还有那里的血统。”他还说，德国人喜欢他的前任、民主党籍总统奥巴马。（看看新闻全球眼） ,特朗普叫屈德国人不喜欢他/美国大选5任总统大乱斗,看看新闻全球眼的微博视频
O2Ttf8Sle,英语演讲精华,True,226467,633025,VOAEC名人演讲：奥巴马可以堪称是当代顶级演讲家之一了。这是43岁的他一战成名的演讲——无畏的希望。 喜欢演讲的朋友要马住！?  #英语演讲精华# http://t.cn/A6xWExC9 #演讲精华##VOAEC精选[超话]##ted演讲##ted# ,英语演讲精华/演讲精华/ted演讲/ted,皓伦王明川的微博视频
OF99wd1eN,大大大餅干丶,True,707858,9266640,#美国民主党到处抓败选战犯##特朗普胜出#   当年民主党奥巴马在演讲时各种批判特朗普...  说实话我一点也不关心奥巴马，但是不知为什么，每次看到奥巴马就觉得看到了一个演绎精湛的演员在表演美国总统～  现在川宝上位了，是时候回击了！[偷乐][偷乐][偷乐]#美国大选# http://t.cn/A6npnM86 ,美国民主党到处抓败选战犯/特朗普胜出/美国大选,大大大餅干丶的微博视频
Opmfbee1k,穗城流年,True,420506,4150139,奥巴马夫妻打电话给哈里斯，支持她竞选美丽坚总统。 http://t.cn/A68f3Sfc ,,穗城流年的微博视频
O7dOV2Ji6,忠贞不渝艾吉奥,True,2454293,208927472,拜登、奥巴马、克林顿三巨头组织的筹款晚会遭人砸场子，有人在台下冲着他们呐喊:“可耻！可耻！可耻！你们种族灭绝巴勒斯坦人！你们双手沾满鲜血！”(来源:X平台) http://t.cn/A6T5pRIq ,,上帝之鹰_5zn的微博视频
O7f29EHcs,孤烟暮蝉,True,7355082,231283226,曼哈顿市中心的无线电城音乐厅外正在上演混乱的场面，拜登总统、奥巴马和克林顿正在那里参加筹款活动。 数百名亲巴勒斯坦抗议者和与纽约警察局发生冲突，导致东西乱飞，人员受到攻击。 警方已经逮捕了多人，随着纽约市执法部门努力重新控制局势。（来源:X原推特） http://t.cn/A6T58Rkn ,,孤烟暮蝉的微博视频
ODx0Oi8kU,两仪生麻瓜,True,252421,2265536,奥巴马媳妇出来了，米歇尔·奥巴马：我们会史诗般击败特朗普。你们不能要总挑剔卡玛拉采访表现不好的地方。我们有权要求生活中的男性对我们更好  美国总统大选，拜登退选时，哈里斯刚被推出来，奥巴马说民主党能选出优秀候选人，大家猜测是米歇尔要出来竞选……  米歇尔奥巴马这段演讲前面两分钟不错， ,,两仪生麻瓜的微博视频
P8XHSqz8w,-书剑舞-,True,175149,1020832,有记者问特朗普在卡特葬礼上跟奥巴马有奸情这件事， 特朗普：我也没想到看上去这么亲热，或许这就是猿粪吧 [二哈] http://t.cn/A6uRWzeJ ,,#NAME?
ODMUXjbi8,参考消息,True,24515472,38207052,#特朗普说尊重奥巴马夫人却换来被她攻击#【特朗普：我尊重奥巴马的夫人 她却攻击我 她犯下了大错】据美媒报道，10月28日，美国前总统特朗普回应前第一夫人米歇尔·奥巴马对其的批评，称她的攻击是一个“大错误”。 http://t.cn/A6ncKVpj ,特朗普说尊重奥巴马夫人却换来被她攻击,参考消息的微博视频
OlijY7BmP,司马南,True,3217475,37482345,【@司马南：拜登迭出奇招儿，日韩预测拜登险胜】 如果美国没有总统，经济照样火爆。一切有条不紊 穷人福利兜底未变，富人财富增长4~6倍，形成马太效应。 拜登在民主党还有可能赢。如果换人，民主党一定输。 因为民主党没有人。 #拜登辩论糟糕表现引发民主党内恐慌##奥巴马就拜登特朗普首场辩论发声#  ,拜登辩论糟糕表现引发民主党内恐慌/奥巴马就拜登特朗普首场辩论发声,司马南的微博视频
OoQ850rw2,上海滩蚂蚁哥,True,657718,11975517,2016年奥巴马交接给特朗普前，就特朗普赢得大选发表演讲，旁边站着瞌睡乔。 http://t.cn/A68bA53D ,,上海滩蚂蚁哥的微博视频
OFcRH5UXv,马上谈,True,477362,23983226,一切的起源：2011年4月30日，美国白宫晚宴奥巴马整整嘲讽了特朗普两分钟，让他坚定了竞选总统的决心。  #普京祝贺特朗普##特朗普小儿子巴伦或成美政坛新星##特朗普胜出# http://t.cn/A6nOvlRj ,普京祝贺特朗普/特朗普小儿子巴伦或成美政坛新星/特朗普胜出,马上谈的微博视频
O7e7jCpYI,寰亚SYHP,True,1959387,61205531,拜登、奥巴马、克林顿在纽约出席筹款活动，一名巴勒斯坦支持者抗议拜登，声称他是“种族灭绝”的推波助澜者。 http://t.cn/A6T5Osvo ,,寰亚SYHP的微博视频
ODO5ibhwx,FUNNY-ANIMALS,True,675019,18861074,这是米歇尔·奥巴马上周六在密歇根州卡拉马祖演讲中的一段  - http://t.cn/A6ncus6L ,,FUNNY-ANIMALS的微博视频
Oyb0g2nOO,衝鋒号角,True,919411,22934534,美国公然通过16亿美元抹黑中国法案，听听当年奥巴马是怎么说的，你就明白了！  反殖畜们又有狗粮领了  #美国拨款16亿美元雇水军黑中国##热门视频# http://t.cn/A6E2jEZO ,美国拨款16亿美元雇水军黑中国/热门视频,衝鋒号角的微博视频
NCQj4vZy4,灭蛙,True,1151973,13973830,大爆炸！萝莉岛事件牵扯出奥巴马夫妇同时与受害者发生关系#萝莉岛##爱泼斯坦##奥巴马##统一[超话]# http://t.cn/A6jc3Dxy ,萝莉岛/爱泼斯坦/奥巴马,武力统一的微博视频
OB5YBfqXM,爱在北方啊,True,57995,218487,#美国大选#奥巴马为哈里斯拉票批特朗普，政治风云再起，美大选前戏火药味十足！  你支持谁？  http://t.cn/A6E8GVbq ,美国大选,世面的微博视频
OBn1C7SVR,今日俄罗斯RT,True,1968258,24562984,【与奥巴马杠上？#特朗普表白黑人男性#：“我爱他们！”】10月12日，在美国总统大选日益临近之际，共和党候选人特朗普在里诺的集会上积极拉拢黑人群体。前不久，美国前总统奥巴马敦促黑人男性支持民主党候选人哈里斯。  特朗普说道：“我的支持率在黑人群体中，尤其是黑人男性中，直线上升。我爱黑人男 ,特朗普表白黑人男性,今日俄罗斯RT的微博视频
