贴文ID,作者名字,认证状态,粉丝数,转评赞数,微博内容,话题名称,视频标题
Og6lktgSE,华尔街见闻APP,True,4050346,12027999,【打工人别想躺平！ 董明珠&刘强东齐放狠话，整顿职场】近日，董明珠在接受媒体访谈时回应了不少热门话题，例如，对于“打工人35岁的坎”，她表示，“没有人招聘你自己去创业”。董明珠还称：“我觉得不是不看只要工资的人，因为你到一个企业来，有什么理由告诉我给你多少钱？当然是有贡献才能谈收入， ,刘强东内部狼性训话流出,华尔街见闻APP的微博视频
P7HUhk4ck,娱十亿,True,78914,3312071,1月1日 江苏宿迁，村民称刘强东又给老家发现金，“每家有几千元礼品，60岁以上老人有一万元”，刘强东曾称当年全村凑钱送其上学 http://t.cn/A6uSfg0P ,,娱十亿的微博视频
P8CPbFzHV,环球纪录频道,True,2239740,48352964,#小学老师回应刘强东发10万元红包#  刘强东第五次回老家给父老乡亲拜年，60岁以上每人一万元现金，每户两千元礼品。不得不说，刘强东是个知恩图报的有良心的企业家[赞]#老师称56个学生仅刘强东考100分# http://t.cn/A6uTx0KB ,小学老师回应刘强东发10万元红包/老师称56个学生仅刘强东考100分,环球纪录频道的微博视频
P8csCeNcj,馋小爷,True,867635,9423167,刘强东邻居：当年泼油漆的人不是本村人，村里人对他家都很爱护！ http://t.cn/A6u0c9iB ,,馋小爷的微博视频
P7IQC9usZ,半程KeMeng,True,515584,18554208,村民称今年刘强东又给老家发现金！1400多户每家都有千元礼品，60岁以上老人每人有万元现金，刘强东曾称当年全村凑钱送他读书（视频来源：潮新闻） http://t.cn/A6uSHG3c ,,半程KeMeng的微博视频
OfMNBl9X5,胜利主义章北海,True,2971733,62198970,开企业怎么进行科学管理很重要，刘强东早年就因为管理措施不到位，开饭店破产了 #京东高管反思管理不善##京东员工上班付费代打卡# http://t.cn/A6H9bAnv ,京东高管反思管理不善/京东员工上班付费代打卡,胜利主义章北海的微博视频
ODH6V6Mwc,余少吖,True,192401,1653720,辛巴最不该惹刘强东，刘强东不是一个网红能惹的，人家是实实在在的企业家。京东养了几十万员工，一个网红跟一个提供几十万老百姓就业的企业家能比吗？不管企业家道德上有什么瑕疵，但是在现实中，网红真的不算什么。 http://t.cn/A6ntxMIn ,,克障_的微博视频
P93it38Iq,情绪别致的蜗牛,True,87722,2745866,刘强东：从此踏上新征程，意气风发启航模板时代 #刘强东# http://t.cn/A6uEKZfO ,刘强东,情绪别致的蜗牛的微博视频
OCTh56hRz,互联网的一些事,True,1562628,8319685,#辛巴怒怼京东# 辛巴怒怼京东，直接点名刘强东，别在背后搞小动作。最近京东怎么回事，连网红都敢直接点名刘强东了…… #辛巴点名刘强东# http://t.cn/A6nAwczN ,辛巴怒怼京东/辛巴点名刘强东,互联网的一些事的微博视频
P8wW1fGUf,晴雨风曰,True,330501,2977897,#记录者[超话]#  男子采访刘强东老家邻居，刘强东邻居：即便不给东西也是应该的。 http://t.cn/A6uYGXbF ,,晴雨风曰的微博视频
OaCaObVuU,电商之家,True,479314,2746376,刘强东：我没有打过一次扑克，因为我知道努力才能让我看得更远、走得更远。 http://t.cn/A6TQ13QQ ,,电商之家的微博视频
P8EldjJ2P,安飞诺,True,495800,3017675,#曾资助刘强东5毛钱上大学老人发声#滴水之恩，当涌泉相报，刘强东之前发文称是乡亲们500元和76个茶叶蛋给了他走向全世界的机会，乡亲们的恩情他会用一辈子来还，他真的做到了！ http://t.cn/A6uTBtMt ,曾资助刘强东5毛钱上大学老人发声,安飞诺的微博视频
O7rIy9XPV,电商报,True,4266512,52793468,雷军评价刘强东很“彪悍”，马云这么厉害还能把京东做大做强！网友：一下子夸赞了两个人。 http://t.cn/A6Tci3mm ,,电商报的微博视频
P8F74mYio,人类爱情大赏,True,231707,3604764,刘强东给乡亲发年货的清单，以为就几样，没想到这么多[哆啦A梦害怕] http://t.cn/A6uTsA3Y ,,人类爱情大赏的微博视频
OCUMalu3S,跨境必读,True,671842,1219111,刘强东：如果失去对京东的控制权，我宁愿把它卖了，拿钱走人，我不会陪投资人在这鬼玩。 http://t.cn/A6nACzli ,,跨境必读的微博视频
P8EO6cTGu,电商行业,True,2904443,8875502,#律师称收到刘强东红包的乡亲需缴税# 滴水之恩，涌泉相报！村民的500块钱76个鸡蛋，却让刘强东铭记至今，2025年春节他又给村民送上了现金和年货。 http://t.cn/A6uTeFP3 ,律师称收到刘强东红包的乡亲需缴税,电商行业的微博视频
JD4VzkVdp,梅大师飞越美中,True,207940,2802209,佩罗西今天违反了她自己的规定：在国会不能说wife  mother grandmother  daughter这种“性别歧视”的用语。  http://t.cn/A65Pdxcb ,,梅小师在美国的微博视频
LFiFP8efn,邱震海,True,2020759,645725,#鸿儒计划# #解放军将展开一系列针对性军事行动#【佩洛西窜台，为何没拦截？解放军锁岛3天大规模演习，预示着什么】佩罗西预计在今天17点将离开台湾前往下一站，今天上午10点她在台湾见了蔡英文，然后11点钟两人共同见了记者中午举行了午餐会 。  http://t.cn/A6aFU3Qj ,鸿儒计划/解放军将展开一系列针对性军事行动,邱震海的微博视频
P8lB5C4I2,困难挡不住精神,False,149642,1248798,刚刚换了钢屁股的宇宙股神，民主党前议长佩罗西，出来谴责“国内极端主义”对新人才和竞选公职人产生寒蝉效应了。顺带她把自己描述成言语暴力的受害人。 上上周她摔坏髋关骨这件事我一直很存疑，从摔坏、开刀到出院，一个八十多岁的垃圾，复原力却惊人，而且这吊毛都不需要复健就出来蹦跶了，钢屁股坐 ,,困难挡不住精神的微博视频
Lo9JzswEY,透视频,True,32016,493872,@司马南 【佩罗西魔术大法，你看懂了吗？】美国官方3号人物，这个被胡同老刘称之为木乃伊的老太太佩洛西，简直是个魔术师呵，她一会儿阴一会儿阳，弄得媒体都蒙圈了，阴阳不定，阴阳失调，到底几个意思啊？#佩洛西称新冠检测结果呈阴性##司马南频道# http://t.cn/A66m02TK ,佩洛西称新冠检测结果呈阴性/司马南频道,透视频的微博视频
JiTjTjKg9,世面,True,6569474,44502455,【#佩洛西回应进理发店不戴口罩#称是“陷阱” 特朗普幸灾乐祸：谢谢你送大礼包】9月2日，美国众议院议长、民主党人南希·佩罗西就违反规定到一家理发店美发一事作出回应，她称“全程被陷害”。8月31日，佩洛西被拍到不戴口罩进入理发店美发，引发网友抨击。 http://t.cn/A64t0UuY ,佩洛西回应进理发店不戴口罩,世面的微博视频
M0v1Up6yN,模型预测,True,357605,1284998,佩罗西：坚持一个中国原则，中国是最自由的社会之一。 疯婆子是怕被没收资产，服软了，来找补？  http://t.cn/A6Swkzy4 ,,模型预测的微博视频
OERc62UUT,台湾蛙事儿,True,199808,1069590,#2024美国大选选举日投票正式开始# 突发：川普刚刚骂佩罗西是婊子！ 在密歇根州大急流城举行的最后一次竞选集会上，川普称南希-佩洛西（Nancy Pelosi）为邪恶的婊子。 http://t.cn/A6n9yC2I ,2024美国大选选举日投票正式开始,台湾蛙事儿的微博视频
OivVbmtrn,岳东晓博士,True,884576,2833837,传川普已经准备对美军进行大清洗：传川普团队已经从美军一星将领中预选100名愿意宣誓效忠川普的将领加以提升，一旦当选，将给美军指挥系统来此大换血，凡是不效忠川普的都将被清除。一旦将美军上层换成效忠人士，则川普江山永固。   川普2020年大选败选之后，Pillowman 一日从白宫出来，手上拿着 ,,岳东晓博士的微博视频
NmNRse6Lj,波士顿圆脸,True,567926,167791,麦卡锡串通佩罗西遭MAGA弹劾出局#国际##美国##社会# 佩洛西 http://t.cn/A6OsoohS ,国际/美国/社会,波士顿圆脸的微博视频
OnDcvqMvL,岳东晓博士,True,884576,2833837,拜登再次就川普遇刺事件发表谈话：拜登说，我们必须反对一切政治暴力。无论是1/6攻打国会，还是威胁议员、州长，还是袭击佩罗西家人，还是刺杀川普，都必须反对。美国创始人明白人类激情的威力，所以他们创建了民主。政治分歧应该在投票箱里解决，而不是使用子弹。我希望大家从今天开始，降低政治热度 ,,岳东晓博士的微博视频
M0wgo7A2C,一-芯-一-伊,True,332613,1995017,#外交部宣布制裁佩洛西# 佩洛西有生之年不多，表示不怕制裁，无关紧要。《大公报》公开资料显示佩罗西老公旗下的铭基环球投资公司总资产已超197亿美元，而有一半的业务都涉及中国企业，包括阿里、拼多多等。#中方制裁佩洛西及其直系亲属#  http://t.cn/A6SA2vus ,外交部宣布制裁佩洛西/中方制裁佩洛西及其直系亲属,一-芯-一-伊的微博视频
LEc8Sa8mm,凤凰卫视,True,14933587,29239104,【#凤凰观察#：#若佩洛西访台中国军队绝不会坐视不管# 中方警告升级】针对美国众议院议长佩洛西计划今年8月访问台湾，有媒体称中方可能作出军事回应。对此，中国国防部新闻发言人谭克非26日警告，如果美方一意孤行，中国军队绝不会坐视不管，必将采取强有力措施挫败任何外部势力干涉和“台独”分裂图谋 ,凤凰观察/若佩洛西访台中国军队绝不会坐视不管,凤凰卫视的微博视频
HDHTPfBFf,福布斯中文网,True,2492039,17586008,14日起，美国将大规模搜捕无证移民。佩罗西和希拉里提醒：如果执法人员敲门，不要开门。[doge]http://t.cn/AiW4g16q ,,World湃的微博视频
K2BOKsjc1,梅大师飞越美中,True,207940,2802209,今天，佩罗西在记者会上提到川普后，马上自言自语：我说了他的名字吗？ http://t.cn/A6tck4bC ,,梅大师飞越美中的微博视频
LFRpr5B9B,CGTN,True,6095052,23562862,【CGTN独家专题片#锁台军演震慑台独势力#完整版来了！】《世界观察》栏目主持人田薇邀嘉宾共同关注实战演训选择环岛六大区域，范围广、靠岛近、力度大、要素全，取得重大突破。并多角度阐述佩罗西的窜访为世界局势、地区安全带来深远恶劣影响。The People's Liberation Army (PLA) is conducting joint ,锁台军演震慑台独势力,CGTN的微博视频
K6ipYlYta,梅大师飞越美中,True,207940,2802209,在采访中，佩罗西称边境的问题是一个“人道主义挑战” 但是，又把锅甩给川普，说这是“上届政府遗留的糟糕的边境系统”所导致。 人不要脸，就天下无敌了。  http://t.cn/A6tmS5fy ,,梅大师飞越美中的微博视频
JDNVF5kHt,身为里中横,True,712075,3905288,#美国大选# 急报！特朗普最后一搏，开启反击拜登拦不住 ！222票赞成204票反对！特朗普拿下佩罗西！ http://t.cn/A65ASL4A ,美国大选,正式预告的微博视频
LFg3aC9jt,厚说信念,True,2188,33466,凤凰记者连线：3日早上实时画面 台北民众聚集抗议佩罗西窜访 http://t.cn/A6ak1k2G ,,厚说信念的微博视频
LFbkotctm,CGTN俄语频道,True,1013132,1094999,【俄专家：美国试图在大选前用“中国牌”替代“乌克兰牌“】7月31日，CGTN莫斯科报道员斯特雷金娜就佩罗西意图窜访台湾一事采访俄科学院美加所首席研究员瓦西里耶夫。俄专家表示，南希·佩洛西访问亚洲是出于美国内政考虑，美国试图在中期选举前用“中国牌”替代“乌克兰牌”，以分散国民对其国内问题的 ,,CGTN俄语频道的微博视频
LEzl2hT0D,凤凰全球连线,True,144669,37593,佩洛西还没有官方宣布会窜访#台湾#，但是媒体已经炒得甚嚣尘上。如果成行的话，这将是美国在台湾问题上对中国最大的挑衅，针对佩罗西这次的「待定行程」，欧道明大学政治学与国际关系助理教授吴萱萱在昨天的节目中观察，这个可能性还是高于50%的。如果成形肯定是会对中美关系，尤其是在台湾问题造成一 ,台湾,凤凰全球连线的微博视频
KAmBwz6nt,梅大师的正能量发言台,True,34783,598610,民主党试图本周通过的3.5万亿美元法案 一共2500页，平均一下的话，每一页超过10亿美元 民主党读过吗？ 佩罗西读过吗？ 舒默尔读过吗？ 瞌睡拜登读过吗？  http://t.cn/A6McSNCp ,,梅大师的正能量发言台的微博视频
LFWlIBEY3,宋中清主任律师,True,330197,934533,#热点[超话]#@司马南 【为什么不把佩洛西留下三天？】解放军联合演训48小时应该把佩罗西留下来多待三天，看看她有多大的法力。解放军多少年想做都没有做的事情，现在在她的帮助下做到了。坏事在一定条件下可以引发好的结果，此系明证。 纽约时报专栏作家弗里德曼直言，佩洛西做了一个愚蠢的事情，在这 ,军事演训为国家统一创造了条件,透视频的微博视频
OnkXca3Hd,岳东晓博士,True,884576,2833837,拜登在底特律演讲列举川普罪状：拜登说，自从上次辩论，媒体对我不时说错人名特别关注，我说错一个人名他们大作文章，而川普把尼基-黑利说成佩罗西他们就不宣传，川普不认识自己老婆他们也视为正常。川普扯什么吃人魔汉尼拨是个好人，他宁愿电死不愿被鲨鱼吃掉，好可怜。但还有更严重的。这几天32个北 ,乌克兰局势,岳东晓博士的微博视频
LF6guy09z,凤凰卫视,True,14933587,29239104,#凤凰观察#【郑浩：#此次台海危机程度史无前例#，一旦开火，#开弓没有回头箭# 】美国众议院议长佩洛西率团访问亚洲，8月1日佩洛西专机已抵达新加坡。而据台媒报道，有消息人士称佩洛西2日晚将抵台。如何看待佩洛西有可能窜访台湾的消息？凤凰卫视时事评论员郑浩表示，此次台海危机已经超过了历史上任何 ,凤凰观察/此次台海危机程度史无前例/开弓没有回头箭/布林肯就佩罗西可能访台表态,凤凰卫视的微博视频
I8CwM11TM,月明如水的娜可露,False,120305,1512275,#2020# #弹劾风波#  川砲发布视频：佩洛西在1998  “共和党不愿给总统（克林顿）一个公正的评判，他们为泄私愤，弹劾总统！” “调查总统严重违反了公平、隐私、制衡的基本原则！” “对克林顿的恨让共和党丧失了心智。他们不放下仇恨，国家就不得安生！” ----------- 这些话换个主语，2019年可以继续 ,2020/弹劾风波,月明如水的娜可露的微博视频
Me3Zbglcs,身为里中横,True,712076,3905288,特朗普在集会上说：南希.佩罗西这个bitch是个畜生，她无缘无故弹劾了我两次！ http://t.cn/A6om1ZJ0 ,,身为里中横的微博视频
LFfNVAVPv,凤凰网视频,True,14832546,78001950,【凤凰报道#佩洛西窜访台湾后岛内气氛紧张# ：民生、军事受到影响】#佩洛西在台行程#据凤凰卫视8月3日报道，佩洛西将于今日前往“台立法机构”发表演说，与台湾“朝野党团”、蔡英文会谈，届时可能会参加媒体互动会，两人有可能接受媒体采访。 佩洛西窜访台湾，使得岛内气氛紧张。8月2日，台湾桃园机场 ,佩洛西窜访台湾后岛内气氛紧张/佩洛西在台行程/对台湾地区暂停天然砂出口,凤凰网视频的微博视频
LF5TllOsK,身为里中横,True,712076,3905288,外媒：佩罗西访台成定局 白宫：众议院议长有权访问台湾 布林肯：北京如因佩洛西访台而制造危机或加剧紧张将负完全责任 美国媒体报道说，有台湾与美国官员透露美国国会众议院议长佩洛西在这次亚洲之行中会在台湾停留。在1日的白宫记者会上，美国国家安全委员会发言人科比并未证实这个消息，不过他说，众 ,布林肯就佩洛西可能访台表态,身为里中横的微博视频
OtIgvBgOe,金陵布衣JLBY,True,149013,921141,8月19日，通信领域专家在《这就是中国》节目中表示：  现在我们一艘舰可以单挑美国航母战斗群！佩罗西不听警告妄图窜台，解放军刚宣布演习，“里根号”撒腿就跑！  PS:通信领域专家讲军事，可靠吗？ http://t.cn/A6RGFg87 ,,金陵布衣JLBY的微博视频
Me3cO0GSM,童慢慢plus,True,199508,6026717,刚刚特朗普在集会上说 “南希佩罗西是个畜生，她无缘无故弹劾了我两次”#特朗普称将宣布重大消息##特朗普或提前宣布竞选2024年美总统##特朗普称佩洛西是动物# http://t.cn/A6omT826 ,特朗普称将宣布重大消息/特朗普或提前宣布竞选2024年美总统/特朗普称佩洛西是动物,木辛瞳的微博视频
OqUDisloi,汝蓝123,False,137450,675263,【把拜登加到总统山上】 南希·佩洛西在CBS周日早间新闻上说，乔·拜登应该被加到Rushmore（总统山）山上。 连左左主持人Lesley Stahl都被雷到了，一脸不敢置信地追问，你是说他（拜登）适合在总统山，把乔拜登和林肯放一块儿？佩罗西说，“罗斯福也在那里啊，我不要求把他拿下来，但是你可以把拜登加上 ,,汝蓝123的微博视频
P5s07A7bv,南归孤夷,True,583271,15566804,介文汲：佩罗西摔倒对于她来讲是流年不利啊，因为特朗普要整她嘛，估计是压力太大了#中国##台湾##美国##特朗普##特朗普换新发型亮相# http://t.cn/A6meXblZ ,中国/台湾/美国/特朗普/特朗普换新发型亮相,南归孤夷的微博视频
LFWbqpjau,透视频,True,32016,493872,@司马南 【为什么不把佩洛西留下三天？】解放军联合演训48小时应该把佩罗西留下来多待三天，看看她有多大的法力。解放军多少年想做都没有做的事情，现在在她的帮助下做到了。坏事在一定条件下可以引发好的结果，此系明证。 纽约时报专栏作家弗里德曼直言，佩洛西做了一个愚蠢的事情，在这样一个时刻招 ,军事演训为国家统一创造了条件,透视频的微博视频
LFfx031lj,凤凰卫视,True,14933587,29239104,【#凤凰记者连线#：3日早上实时画面，台北民众聚集抗议佩罗西窜访】佩洛西8月3日在台湾的行程有哪些？对于她的窜访，台湾岛内还有哪些反应？据报，佩洛西今天上午在酒店与台积进行电视像会谈，也会访“立法院”并与蔡英文会面。在凤凰记者实时连线过程中，可以看到记者身后的台“立法院”外有大量民众 ,凤凰记者连线/台北民众高喊佩洛西滚回去,凤凰卫视的微博视频
OER6X7bGq,金华磊哥,True,1200655,11448410,川普刚刚骂佩罗西是婊子！#三分钟解读美国大选乱象# http://t.cn/A6n9LeFX ,三分钟解读美国大选乱象,金华磊哥的微博视频
JzB97s7EI,梅大师飞越美中,True,207940,2802209,国会议员们统统在骂娘 5593页的法案（就是视频中这一叠），需要在4个小时内看完并且投票 南希佩罗西真是脑子坏了。  http://t.cn/A6qoExrs ,,梅小师在美国的微博视频
LFq2O3Dm9,墨卿,False,14027,26125,在佩罗西窜访台湾前后，台湾岛内出现政府所属网站，公关基础网络设备瘫痪等网络攻击。一个称为APT27 Attact的黑客组织宣布对台湾政府网络和基础IOT物联设备的攻击负责。#桃园机场明日取消40个航班##APT27宣布对台IOT网络攻击负责# http://t.cn/A6as2qTX ,桃园机场明日取消40个航班/APT27宣布对台IOT网络攻击负责,墨卿的微博视频
M0ccevXPQ,潇洒友A,True,637752,9295312,佩罗西的到来是中国故意的放行？重磅消息来了：这次台海军事封锁，至少看到了三大效果：第一种效果是美国保护台的画皮被揭开，他根本做不到。美国的航母直接掉头跑了。在中美关系上：中国已经越来越获得主动。中方采取的措施的严厉性和果断性。中国外交部8月5日宣布：采取对美八项反制措施……。见视频 ,解放军,潇洒友A的微博视频
Odz2YhE1b,纪春生在美国,True,515532,3369669,希拉里上”Morning Joe”谈学生抗议: 图样图森破。  “They don't know very much at all about the history of the Middle East or  frankly  about history in many areas of the world.” [揣手] http://t.cn/A6Hyr86y ,,纪春生在美国的微博视频
OtcBHEeIM,西雅图夏至,True,378328,3489620,民主党2024全国代表大会，希拉里讲话：2016，我被提名，是毕生荣耀；6600万人，选择了“没有玻璃天花板”的未来；之后，我们没有放弃，继续朝这个目标努力；朋友们，那个未来，已近在眼前；如果我的母亲、Harris的母亲还在世，一定会说：继续努力！我的经历就是美国故事，只要奋斗就会有进展，但必须坚 ,,西雅图夏至的微博视频
Llkxo72qh,胜利主义章北海,True,2971732,62206947,《美国笑话》 一、 美国病房里，三个病人交流确诊新冠的原因 A：我反对特朗普的防疫政策 B：我支持特朗普的防疫政策 C：我就是特朗普  二、 “这是一幅画，名字叫《希拉里在波兰》” “可我只看到克林顿和莱温斯基在亲热，希拉里呢” “她在波兰”  三、 美国建国初期，一名政客在州议会表示：“我们要 ,美国生物实验室的背后,胜利主义章北海的微博视频
OwujJqg3M,大大大餅干丶,True,707782,9259706,#美国大选#   共和党总统候选人唐纳德·特朗普（Donald Trump）和民主党副总统卡玛拉·哈里斯（Kamala Harris）在激烈的总统竞选中首次交锋...  有没有发现今年的美国大选完全没热度？当初特朗普和希拉里那场辩论多精彩～  美国政坛真的是没人了～🙈🙈🙈#特朗普vs哈里斯首场电视辩论#  ,美国大选/特朗普vs哈里斯首场电视辩论,大大大餅干丶的微博视频
MiecLq4li,MingZhC,True,459929,5681710,希拉里给所有小女孩的建议，温暖又坚毅 http://t.cn/A6Kxda5E ,,北京Fund的微博视频
Ot9yI1OKv,凤凰卫视,True,14933708,29245726,【#希拉里炮轰特朗普#：“戴罪”参选】“唐纳德·特朗普在自己的审判中睡着了，当他睡醒时，他创造了自己的历史，成为第一个带着34项重罪参加总统选举的人。”美国前国务卿希拉里19日在民主党全国代表大会发言时，炮轰共和党总统候选人特朗普是重罪犯，赢得全场欢呼。（凤凰卫视魏绍坤 综合报道）  ,希拉里炮轰特朗普,凤凰卫视的微博视频
M2vvnjGCT,纪春生在美国,True,515532,3369669,希拉里和Chelsea 的<Gutsy>9月9日上线。 http://t.cn/A6SxmXyJ ,,纪春生在美国的微博视频
ODu3Yie4X,盖世英雄玉椒龙,True,409190,30621790,很多人说希拉里这个败选演讲体现了希拉里的大度，其实希拉里当时根本没办法接受败给特朗普，等了一天缓过劲来才进行的演讲。#特朗普要向台湾收保护费# #特朗普谈总统任期中犯的最大错误#  #奥巴马妻子称投特朗普是反对女性#http://t.cn/A6nGfRwx ,特朗普要向台湾收保护费/特朗普谈总统任期中犯的最大错误/奥巴马妻子称投特朗普是反对女性,盖世英雄玉椒龙的微博视频
OoPYl6MEB,童鞋的利剑_777,False,221343,1042587,如果这种情况确实发生，白帽子将利用这个机会揭露（克隆）希拉里的罪行，就像他们对乔·拜登所做的那样。 http://t.cn/A68bw79D ,,童鞋的利剑_777的微博视频
OFcrXhxWp,包容万物恒河水,True,973283,86082031,🔻笑死了，哈里斯的败选演讲难道是抄希拉里的吗？ 🔻这下真的双输好过单输了。 #特朗普小儿子巴伦或成美政坛新星##美国大选追踪# http://t.cn/A6n0e7aL ,特朗普小儿子巴伦或成美政坛新星/美国大选追踪,包容万物恒河水的微博视频
P23nZfVS7,VA仨金花,False,13842,83974,奥巴马，希拉里，书墨这些民主党大佬对非法移民的态度和现在的川普似乎没什么区别。那么问题是民主党以前care美国公民，而现在不care了吗？或者说以前还装装样子care，而现在干脆装都懒得转了，直接本色出演[怒] http://t.cn/A6mLjKHe ,,VA仨金花的微博视频
Oj5VMDXNF,娱乐探神,True,939986,32001009,#亚洲首富之子婚前百亿派对# 3天花掉10亿人民币办婚前派对，比尔盖茨、扎克伯格、希拉里都来捧场，这么土豪的家族到底什么来头？ http://t.cn/A6QwkUQL ,亚洲首富之子婚前百亿派对,娱乐探神的微博视频
NuXfe6wei,环球时报,True,31208054,466077152,#希拉里被亲巴勒斯坦学生抗议##希拉里被喊支持种族灭绝#【希拉里在哥伦比亚大学遭亲巴勒斯坦学生抗议，学生喊：你支持种族灭绝，可耻！】据英国《独立报》网站30日报道，美国前国务卿希拉里·克林顿29日在纽约哥伦比亚大学遭亲巴勒斯坦学生抗议。  报道称，当天希拉里来学校讲课，一群学生在大楼内抗议 ,希拉里被亲巴勒斯坦学生抗议/希拉里被喊支持种族灭绝,环视频的微博视频
