贴文ID,作者名字,认证状态,粉丝数,转评赞数,微博内容,话题名称,视频标题
OCAFwkayO,名人张聊,True,928483,1597020,腾讯马化腾：为招聘一名外籍科学家，我们甚至专门做了一个ppt。  #马化腾##腾讯##人才招聘##老张杂谈# http://t.cn/A6nhFY7x ,马化腾/腾讯/人才招聘/老张杂谈,名人张聊的微博视频
KeScFBnFH,电商报,True,4266514,52793385,【珍贵视频回顾】马云、马化腾罕见同台领奖，主持人问马云：你和马化腾都姓马，都是做互联网的，能不能说说你们二马之间有什么显著区别？马云调侃：他长得比我帅！[doge] http://t.cn/A6V7VsXk ,,电商报的微博视频
NEfhP2TYN,凤凰网科技,True,4592875,49345052,【#马化腾年会同款毛衣网店卖79元# 】#马化腾年会红毛衣某宝79元# 近日，腾讯举办年会，马化腾现身登台唱粤语歌曲《祝福你》。其中马化腾身穿的红色毛衣被网友发现在网上仅售79.99元包邮。  @凤凰网科技 实测发现，售价79.99元属实，经过仔细比对，外观一致。目前已售出200件。通过图片搜索，在电商平 ,马化腾年会同款毛衣网店卖79元/马化腾年会红毛衣某宝79元,凤凰网科技的微博视频
OFaWU6qAF,上海滩蚂蚁哥,True,657845,11975542,为什么网友只敢恶搞雷军，却不敢动马云马化腾？只因他的格局远超他人 http://t.cn/A6n0Cn3k ,,上海滩蚂蚁哥的微博视频
OckryewqD,伯阳先生-段本司,True,316995,6878991,#褚会长称990万已支付完成#     “礼不下庶人“ 的另外一种字面意义上的歪曲体现  又是让周鸿祎介绍马化腾（恶意玩笑，故意给他难堪） 又是质问周鸿祎是否真的吃了头孢不能喝酒（潜台词是你老周是不是看不起我们装病不喝酒）  周鸿祎大概率已经很多年没和阶级、地位差距巨大 而又不受他的利益链条管辖 ,褚会长称990万已支付完成,伯阳先生-段本司的微博视频
O9kHNBJ8P,麒炜投资,True,287733,3122164,马化腾:一步踏错巨头也会倒下！#苹果市值一夜暴涨8113亿# http://t.cn/A6TCnpJt ,苹果市值一夜暴涨8113亿,麒炜投资的微博视频
Omrg9i269,恰到好处的华丽,True,151642,604527,#一枚军粉[超话]#为何说马云永远都干不过马化腾？#商业思维 ##财经##老板 ##臧其超# http://t.cn/A6QRggzX ,商业思维 /财经/老板 /臧其超,涵椰冰的微博视频
O2O6wFKra,司马南,True,3217599,37482398,【@司马南：2023的小黄，他怎么赚钱那么容易?】 中国最赚钱的人？ 以股票市值计算，他的财富在一年间增加了1000亿，平均每天暴赚2.7亿元，每小时就能收入1125万; 马化腾、丁磊、李书福、李想也都实现了身家的逆势上涨。 除了这些大老板，带货直播间的小杨哥、董宇辉等网红主播也都是逆势大赚的典型。  ,中国什么生意最赚钱,司马南的微博视频
O3i6Dn8Z2,文化芝士分子,True,148593,241490,马化腾演讲大会，对末来财富趋势 http://t.cn/A6YRXfFf ,,文化芝士分子的微博视频
N9ptI0pGM,电商行业,True,2904443,8875502,马化腾正面回应抄袭：在我看来，我倒无所谓谁抄谁，因为最难的是你能不能满足用户的需求。 http://t.cn/A60Z9Yxh ,,电商行业的微博视频
LasCshRLa,财联社APP,True,4116488,23524352,#马化腾说腾讯只是一家普通公司#【马化腾：腾讯只是一家普通公司，随时都可以被替换】在日前举行的腾讯员工大会上，马化腾对2021年发生的一系列变化表达了自己的想法，他说，腾讯只是国家社会大发展期间的一家普通公司，是国家发展浪潮下的受益者，并不是什么基础服务，随时都可以被替换。未来，腾讯在 ,马化腾说腾讯只是一家普通公司/马化腾称腾讯随时可以被替换,财联社CC新闻的微博视频
La9ifbKeN,思想先行,True,2889542,6882733,当被问到你怎么看马云，马化腾的回答情商很高滴水不漏。  http://t.cn/A6JbSwik ,,思想先行的微博视频
Ogx4ynCoq,名人张聊,True,928483,1597020,腾讯创始人马化腾：人品不正，能力再强也不要。  #马化腾##腾讯##企业管理##老张杂谈# http://t.cn/A6Hlxm6S ,马化腾/腾讯/企业管理/老张杂谈,名人张聊的微博视频
Mruw2pHtd,跨通社,True,112710,1611006,马化腾回怼专家 ：很多企业家、创始人的直觉是非常准的。创业需要实战，而不是纸上谈兵！ http://t.cn/A69BlUIN ,,跨通社的微博视频
LDMBRAsmt,许有希光,True,325199,6342648,马化腾：未来几十年，WeChat和QQ将会消失！ http://t.cn/A6anrxK9 ,,许有希光的微博视频
MnaDHAXTz,夏沫花雨_,True,294,6904,#马化腾[超话]# 小马哥讲述创业初期受过的委屈！出去争取订单经常吃闭门羹，团队都是技术出身的脸皮特别薄，每次出门都变得胆战心惊。没钱了，连服务器都没地方放了！ http://t.cn/A69PKT21 ,,夏沫花雨_的微博视频
NBuAOF1GA,名人张聊,True,928483,1597020,马化腾的这一段话，说出了目前中国专家存在的问题。#马化腾##腾讯# http://t.cn/A6jZskub ,马化腾/腾讯,名人坊间八卦的微博视频
L4oebdIqF,老殁,True,614162,1756360,宗庆后当众问腾讯服务器在哪里？马化腾支支吾吾说了一堆借口理由却不敢说实话。 http://t.cn/A6xNdJST ,,老殁的微博视频
KroXEnOgr,中国IT杂谈,True,2686103,6266814,马化腾谈腾讯和阿里的竞争，说出了实话：老大老二竞争时候，往往老三老四完蛋了[允悲]#微博放映厅# http://t.cn/A6Ivs2om ,微博放映厅,中国IT杂谈的微博视频
P3C30u0WG,顺十而为,True,228120,5627084,1万微信好友不够！周鸿祎求助马化腾，感谢微信上线“单删好友”功能 http://t.cn/A6mKTDrX ,,顺十而为的微博视频
Oix7Gkq2a,电商行业,True,2904443,8875502,马云马化腾同台领奖，马云调侃自己长得不咋地：马化腾比我帅。 http://t.cn/A6Hs1Vyw ,,电商行业的微博视频
Laoblw3iD,老板联播,True,6092931,154984760,【#腾讯还是普通公司吗#？#腾讯起家史#：23年前马化腾是这样子】近日#马化腾说腾讯只是一家普通公司#。1998年，腾讯从在深圳华强北赛格科技园一间办公室起步。你知道马化腾曾在华强北装过电脑吗？你知道今天那只胖嘟嘟的QQ企鹅原来是瘦长的吗？来看看23年前的小马哥和腾讯，到底经历了什么才走到今天？ ,腾讯还是普通公司吗/腾讯起家史/马化腾说腾讯只是一家普通公司,老板联播的微博视频
Lekjo6rP9,模型预测,True,357603,1284941,【马化腾】拿出10天的王者荣耀利润，支持中国基础科学研究！ 小马哥值得信赖 http://t.cn/A6i0Z29S ,,模型预测的微博视频
OeoBHh3dR,麒炜投资,True,287733,3122164,#腾讯# CEO马化腾暗讽马云:阿里的赋能更像一种绑架！  性情中人，敢做敢说！ http://t.cn/A6Hco3VF ,腾讯,麒炜投资的微博视频
Mn2ZFjWTh,历史探秘,True,1493701,7780029,腾讯创始人马化腾：我不在乎谁抄谁。全世界都抄美国模式！[思考][并不简单] http://t.cn/A69v0exH ,,历史探秘的微博视频
OvcjpwP0S,数码新探,True,455497,242380,微信可能真的会败给苹果，腾讯、马化腾面临挑战。 #微信# #腾讯# http://t.cn/A6RN5FBF ,微信/腾讯,数码新探的微博视频
KnMyTrqef,游戏电竞君,False,2301666,9516773,所以排位妥妥的是被设计了？ 怪不得人机越打越像真人了[doge][doge]  #马化腾称王者荣耀将举办AI电竞赛#  http://t.cn/A6foxHPO ,马化腾称王者荣耀将举办AI电竞赛,游戏电竞君的微博视频
LC9g9BDow,金刀王,True,1764762,10478305,#深圳大学#马化腾吐槽母校深圳大学：教授工资太低，校长喊我捐钱...   cyc http://t.cn/A6apOA8T ,深圳大学,金刀王的微博视频
Lo4OK2PkA,电商报,True,4266514,52793385,#马化腾说微信超越QQ我也没办法#：QQ的手机端、PC端是不同的老板在管，要改变心有余而力不足。所以换微信越改越像QQ。[喵喵]#微信农场##微信农场背景##如何评价微信农场##微信农场为什么这么火# http://t.cn/A66nDlp9 ,马化腾说微信超越QQ我也没办法/微信农场/微信农场背景/如何评价微信农场/微信农场为什么这么火,电商报的微博视频
O8NMHAKfX,电商行业,True,2904443,8875502,马化腾回应微信提现手续费：我们承担不起巨额成本，但普通用户其实并不受太大的影响。 http://t.cn/A6TSaKwN ,,电商行业的微博视频
NBtLE9lYs,名人张聊,True,928483,1597020,马化腾 ：每年春节后都发开工红包，可是老外们还是不明白啥是lucky money。#马化腾##腾讯##开年红包# http://t.cn/A6jZ3Ld0 ,马化腾/腾讯/开年红包,名人坊间八卦的微博视频
ODNjQlCUF,靖安发布,True,34529,159225,【2024胡润百富榜：#张一鸣3500亿身家成中国首富#】#宗馥莉810亿身家成中国女首富#10月29日，2024胡润百富榜发布，张一鸣以3500亿元身家成中国首富，钟睒睒退居第二，马化腾位列第三，宗馥莉成中国女首富，财富810亿元。不过，最新的福布斯和彭博实时富豪榜上，中国首富仍是钟睒睒，财富值分别为3585亿 ,张一鸣3500亿身家成中国首富/宗馥莉810亿身家成中国女首富,澎湃新闻的微博视频
KjcDdpjdq,娱说星迹,True,251002,12284570,从来没有清晰的认识过马化腾，现在真的是大人小孩都逃不过马化腾手掌 #动漫综艺咖##视频创意话题大赛# http://t.cn/A6VRSbUh ,动漫综艺咖/视频创意话题大赛,动漫综艺咖的微博视频
P7gPGpqQC,柴孝伟,True,170960,268482,滴滴程维，只要思维在上坡，办法总比困难多。  #财经##商业世界##企业家##热门视频# http://t.cn/A6uMMSOa ,财经/商业世界/企业家/热门视频,柴孝伟的微博视频
NxldiDDQo,軍醫周曉峰,False,862901,4826803,马云 马化腾 王健林等首富们最真实的一面 2024远离无用社交，什么亲情友情爱情，没钱谁都看不起你，多跟一些有能力的人在一起，活到老学到老…… http://t.cn/A6lML6Sc ,,軍醫周曉峰的微博视频
M7PtrtrTb,后厂炒饭哥,False,9115,30827,为什么国外互联网公司在华屡屡失败，听听腾讯马化腾怎么分析[并不简单] http://t.cn/A6oPsYIO ,,大厂灵通师的微博视频
O4e8AFam9,刘润,True,732348,1051572,本期访谈重点： 2024，国内外还有什么机会？ 吴晓波老师怎么看待如今直播行业的“暴利” 当下出海很重要，但我们到底应该怎么做？ 如今中国的创业环境是怎样的？ 老一代创业者和现在的创业者，有什么本质上的不同？ 吴晓波老师当初被告“抄袭”，有什么心路历程？#吴晓波##刘润##直播##马化腾##张瑞敏# ,吴晓波/刘润/直播/马化腾/张瑞敏/机会,刘润的微博视频
OcfrACc1K,好大的奕,True,688061,5566971,老周拍卖完他前妻名下的迈巴赫600之后，邀请竞拍得主吃了顿饭。 但是，这顿饭好像吃得不是那么开心…[允悲]  “周总，您能介绍马化腾我认识一下吗？” “周总，加你微信了，你通过一下”  老周：“我最近吃头孢了，喝不了酒” “真的假的？”  …  整个场面确实挺混乱的。 甚至还有绕过周鸿祎这个“东 ,,好大的奕的微博视频
MeXw8nO0E,名人故事-,True,142785,227944,腾讯董事长办公室竟对马化腾大吼格局#名人故事##名人经历#  http://t.cn/A6oDSuMB ,名人故事/名人经历,名人故事-的微博视频
MkTA54KiF,吐槽曝料,True,1309637,8311147,烟台：这年头敢扶老人的，除了善良，更多的是需要勇气，这女的没录像就扶了，好人一生平安！🙏#吐槽曝料[超话]##马化腾称短视频冲击了游戏# http://t.cn/A6KQHFSj ,马化腾称短视频冲击了游戏,吐槽曝料的微博视频
KlIACh03P,电商报,True,4266514,52793385,马化腾曾遭遇尴尬提问：腾讯走自己的路让别人无路可走？马化腾：这是一个很大的误解，没有扼杀小公司的梦想，只是没合作。[doge] http://t.cn/A6fUIYKd ,,电商报的微博视频
NCp7KqGCV,名人张聊,True,928483,1597022,半夜焦虑到上知乎提问? 马化腾：是的，我非常焦虑！#马化腾##腾讯##知乎# http://t.cn/A6jGKqGx ,马化腾/腾讯/知乎,名人坊间八卦的微博视频
P3Cwfd0EE,金融八卦女,True,3518982,14163669,#周鸿祎感谢马化腾解决微信好友上限问题#上次卖迈巴赫，请二手车商吃饭，晚宴上的人都说他不愿意加他们为好友，让他浑身是嘴也说不清楚。万般无奈，只好找马总求救。马总默默升级了微信，给了一个很有效的解决方案。”接着周鸿祎在视频中展现了他在微信删除单向好友的操作画面。  周鸿祎还表示，“我要 ,周鸿祎感谢马化腾解决微信好友上限问题/周鸿祎对想加微信的来者不拒,东方财经的微博视频
OjdWggJYZ,名人张聊,True,928483,1597022,腾讯创始人马化腾：要有所为有所不为，找最有潜力的合作者比死磕更有效。  #马化腾##腾讯##企业管理##老张杂谈# http://t.cn/A6Q2MQQL ,马化腾/腾讯/企业管理/老张杂谈,名人张聊的微博视频
L7OMryiq3,今日灼见,True,1059519,6903207,【马化腾宣布：近乎清仓式减持京东！1000亿股票直接送给腾讯股民！网友：共同富裕了】  23日一大早。腾讯就搞了一件大事，变相的、几乎全仓“减持”京东的股份，自己只留2.3%，不再是京东的第一大股东。  另外，更骚的操作来了：“减持”的京东股份，直接送给腾讯的股东！  01  派息式减持！腾讯对京东 ,老铁说股,老铁说股的微博视频
O9EnVtPk9,麒炜投资,True,287733,3122240,雷军说:马化腾创业的时候要把QQ卖给我我没买，阿里巴巴找我投资我没投！  一语道破隐藏多年的秘密……哈哈哈！http://t.cn/A6T0JFWi #su7上市前半月雷军平均日更5条微博# #雷军问大家满意小米汽车吗# ,su7上市前半月雷军平均日更5条微博/雷军问大家满意小米汽车吗,麒炜投资的微博视频
NeEhWinCx,通信老柳,True,1333609,3932632,马化腾年轻时候有多牛？看完只有佩服二字！不要相信牛人都是白手起家。 http://t.cn/A60dHn59 ,,通信老柳的微博视频
O5r4Xk5ub,金刀王,True,1764762,10478305,#身边逐渐消失的职业#小偷越来越少了几乎消失了，消灭小偷的是马化腾大人，你能想得到？现在还有的小偷可能也就是复古一下吧，或者渣男偷心。 http://t.cn/A6TPjkxg ,身边逐渐消失的职业,金刀王的微博视频
M0zQijC1n,老板联播,True,6092931,154984760,【#雷军曾报价1000万收购网易遭拒#，#雷军玩BBS结识马化腾和丁磊#】8月11日晚，#2022雷军年度演讲#上，雷军揭秘，玩BBS时认识了不少朋友，一位就是在一家寻呼机公司做程序员的马化腾，还有一位是宁波电信局的工程师丁磊。1997年互联网兴起之后，他准备让金山以收购的方式进军互联网，他向丁磊报价1000 ,雷军曾报价1000万收购网易遭拒/雷军玩BBS结识马化腾和丁磊/2022雷军年度演讲,老板联播的微博视频
Lu61Mf1fy,许有希光,True,325199,6342648,马化腾在未来论坛上演讲表示：中国基础学科非常薄弱，移动支付的发展只是表面辉煌，实际上如同“海滩上建楼，一推就倒”，所以，我们不能再抱有侥幸心理，一定要投入更多资源在基础科学方面”。#夏日视界##给视频加buff# http://t.cn/A6XSlPJJ ,夏日视界/给视频加buff,许有希光的微博视频
OCoNb5AYl,名人张聊,True,928483,1597022,马化腾开会：连开三个小时，所有人提前10分钟厕所集合。  #马化腾##腾讯##工作效率##老张杂谈# http://t.cn/A6Esk13o ,马化腾/腾讯/工作效率/老张杂谈,名人张聊的微博视频
Odd6EmMGB,电商行业,True,2904443,8875502,我们移动支付有多领先，马化腾：连街上的乞丐都支持扫码。 http://t.cn/A6HAbmI8 ,,电商行业的微博视频
KnLQYa3gY,中新经纬,True,15010590,152523473,【#马化腾称王者荣耀将举办AI电竞赛# 你期待吗[喵喵]】2021世界人工智能大会开幕式上，腾讯公司董事会主席兼CEO马化腾虽然缺席，但他用语音带来一个新消息：这次腾讯带来王者荣耀的AI电竞赛，希望让大家欣赏到最高水平的AI竞技的同时，激发青年人对通用AI的研究兴趣。#马化腾再次缺席世界人工智能大会# ,马化腾称王者荣耀将举办AI电竞赛/马化腾再次缺席世界人工智能大会/财视频,中新经纬的微博视频
OoaJZ2HgN,电商报,True,4266514,52793385,张一鸣长着一张娃娃脸，身为创始人，却一度被忽略，然而他靠着自己的能力和认知，干出了万亿帝国！ http://t.cn/A68zlEBy ,,电商报的微博视频
L69G9nQEB,历史探秘,True,1493702,7780029,娃哈哈创始人宗庆后当众问服务器在哪，腾讯马化腾半天不敢说～[允悲] http://t.cn/A6xE759v ,,历史探秘的微博视频
OBaSdyxXU,麒炜投资,True,287734,3122245,38岁的雷军说：每天时时刻刻都在提醒自己，千万别把自己当人看！  谈到周鸿祎、马化腾、李彦宏…… #雷军给的人生建议都好接地气# http://t.cn/A6ERQjUO ,雷军给的人生建议都好接地气,麒炜投资的微博视频
Lw1DQsPK7,鸡王陈大白,False,2958509,293731,马化腾，我怀疑这设计师是不是你小姨子啊！#和平精英# #吃鸡# #陈大白#  http://t.cn/A6XH9WHG ,和平精英/吃鸡/陈大白,鸡王陈大白的微博视频
KA5zznaQw,清凉历史,True,574859,1224552,刘强东：我用了30年时间，才能和马化腾马云坐一起喝咖啡、谈合作#清凉历史# #微博公开课# #视频新星榜# http://t.cn/A6M5Gle1 ,清凉历史/微博公开课/视频新星榜,清凉历史的微博视频
P2RK5BnS0,跨境必读,True,671842,1219111,宗庆后质问马化腾：我们的后台服务器到底在美国还是中国，对此马化腾面露难色无法做出正面回答。 http://t.cn/A6mf8bKX ,,跨境必读的微博视频
Ot7mJ5gPz,盖世肉姐,True,165381,541067,吴召国嘲讽辛巴：比如雷军，马云，马化腾在大佬面前啥也不是。何况我们算啥呢！低调做人，老老实实的做事，千万别张狂到‘我是神’！啪一个雷打过来，你就死了！ http://t.cn/A6RA6dTs ,,盖世肉姐的微博视频
LlbZmoqQM,金融八卦女,True,3518983,14163669,腾讯只是一个普通公司[doge]【#马化腾说腾讯业绩像自己的腰一样#：不那么突出了】 在2020年一场线上交流中，马化腾曾和员工调侃起自己腰椎不好的老毛病，经过了一年时间的锻炼，拍了部腰的片子，片子的结果和腾讯2020年的业绩一样“突出”；一年后，在那场引发了“腾讯是一家普通公司”热议的员工大会 ,马化腾说腾讯业绩像自己的腰一样/腾讯净利增速创十年来新低,第一财经日报的微博视频
Mo75SuMpt,螺旋实验室,True,1341,2331,天津大爆炸靠近腾讯天津最大数据中心，马化腾：如果再严重一点，你们朋友圈数据全都没有了 http://t.cn/A69LQKsY ,,螺旋实验室的微博视频
OcPTF4ALj,麒炜投资,True,287734,3122245,腾讯CEO马化腾:微商让我很头疼，他们动不动就拿钱跑路了！ http://t.cn/A6H7Yh6L ,,麒炜投资的微博视频
ODaPm8P7N,数码新探,True,455497,242380,马化腾最新内部发言：查处的贪腐问题“令人震惊”。 #最新# http://t.cn/A6nyYeh7 ,最新,数码新探的微博视频
Oy1Ra2Zkq,跨境必读,True,671842,1219111,马化腾：马云所说的赋能实际上是拿捏住了你的命脉，这跟我们有很大的不同。 http://t.cn/A6EAPztW ,,跨境必读的微博视频
KnLKuzrxW,大河财立方,True,3922676,7647634,【马化腾：我们对AI的未知仍然大于已知】7月8日，#2021世界人工智能大会#在上海开幕。腾讯公司董事会主席兼首席执行官马化腾在开幕上发表演讲指出，过去5年，AI在医疗、城市治理、非接触服务等领域为生活带来越来越多的便利，“但我们#对AI的未知仍然大于已知#。” http://t.cn/A6fo5UmT ,2021世界人工智能大会/对AI的未知仍然大于已知,大河财立方的微博视频
M5Z0HxuzQ,新浪科技,True,23801350,272803717,#马化腾辟谣羊了个羊小程序日赚468万#【羊了个羊日收入468万？马化腾辟谣：图是PS伪造的】#羊了个羊制作人否认日入468万# 近日，《羊了个羊》小游戏爆火，网上流传一张截图显示，《羊了个羊》小程序9月14日收入达到468万余元，而本月收入也高达2565余万元。随后，马化腾在相关朋友圈下面评论：核实了是 ,马化腾辟谣羊了个羊小程序日赚468万/羊了个羊制作人否认日入468万,新浪科技的微博视频
MegIAs9cD,臭臭新说,True,653208,2044135,马化腾教你做人。在一次大佬云集的论坛上，当马化腾发言的时候，坦诚的说：「我觉得我资历不够」，可以听听这段，说的很平静，也非常坦诚。 http://t.cn/A6o3gupH ,,臭臭新说的微博视频
Mdifs5h6X,全景网,True,2541459,9031556,#马化腾称移动互联网才是真正的互联网#，80%流量来自手机，现在都不开发Windows系统软件，因为没有人用！ http://t.cn/A6oTca36 ,马化腾称移动互联网才是真正的互联网,全景网的微博视频
P3BdUo5Ne,东方财经,True,1926317,1741812,【#周鸿祎感谢马化腾解决微信好友上限问题#，#周鸿祎对想加微信的来者不拒#】12月6日，360集团创始人、董事长@红衣大叔周鸿祎 发视频感谢马化腾增加微信好友查单删功能，他表示：“马化腾马总帮了我一个大忙，我真的特别感谢他。他把微信增加了一个功能，解决了困扰我很久的痛点。平时任何人加我微信， ,周鸿祎感谢马化腾解决微信好友上限问题/周鸿祎对想加微信的来者不拒,东方财经的微博视频
M0AmDw4qL,中新经纬,True,15010590,152523473,#雷军称泡论坛认识了网友马化腾丁磊#【#雷军回忆最迷茫时刻#常去泡吧，一蹦一晚上[doge]】8月11日，在2022雷军年度演讲上，@雷军 表示自己年轻时曾陷入迷茫，为了缓解压力经常去泡吧蹦迪，和朋友一蹦一晚上。雷军说是BBS论坛拯救了自己，并且在论坛上还认识了当时在做程序员的马化腾和工程师丁磊。 ,雷军称泡论坛认识了网友马化腾丁磊/雷军回忆最迷茫时刻/雷军7天成销冠,中新经纬的微博视频
OlApIv53G,李光斗,True,1611975,738483,为什么首富都跑不过李嘉诚？#商业思维##李嘉诚##马化腾##王健林# http://t.cn/A6QOg1lx ,商业思维/李嘉诚/马化腾/王健林,李光斗的微博视频
N3g605NwH,马上谈,True,477044,23963168,因错过投资阅后即焚，马化腾感慨：什么都没做错，就错在太老了…怪不得最近几年互联网中小企业又蓬勃发展了，感谢老去之恩[doge][doge][doge] http://t.cn/A6p4ojRY ,,马上谈的微博视频
P3CsVm86Z,大河财立方,True,3922676,7647634,【#微信上线新功能##周鸿祎发视频感谢马化腾#】12月6日，360集团创始人、董事长周鸿祎发视频感谢马化腾增加微信好友单删功能。周鸿祎表示：“我真的特别感谢马化腾，他把微信增加了一个功能，解决了困扰我很久的痛点。“此前，微信上线了新功能，当微信好友量到达1万上限后可查单删好友。具体而言，微 ,微信上线新功能/周鸿祎发视频感谢马化腾,大河财立方的微博视频
M9PgmvrGb,鬼文子,True,989737,1663384,【#科技考古#：解析人人公司CEO陈一舟的聪明人生】曾在社交领域与马化腾同期竞争，为何周鸿祎说他是湖北第一聪明？#微博公开课##微博新知博主# http://t.cn/A6ott0D8 ,科技考古/微博公开课/微博新知博主,鬼文子的微博视频
O2pG6BcLK,老高电商圈子,True,3007356,16029657,刘强东与马化腾联姻，半数以上高管曾联名反对！ http://t.cn/A6Ylq9vf ,,老高电商圈子的微博视频
KFQCWpXH9,深圳晚报,True,7745080,5707384,【#马化腾高中母校学弟对话诺奖得主#】霍金点与宇宙熵减、人类意识与量子效应......这居然是深圳中学00后高中生周恩正与“90后”诺奖得主彭罗斯的对话话题。硬核提问引得彭罗斯频频点头：“相当好的问题”，恩正表示这次对话让他更坚定地想成为科学家，将知识回馈到社会和世界上。00后这样硬核追星值得 ,马化腾高中母校学弟对话诺奖得主,深圳晚报的微博视频
Mcy5CgcpX,胡锡进,True,24850352,127503309,马斯克在10月6日的这段视频里明确说要“抄微信”，很公然很理直气壮。他现在完成了对推特的收购，可以将“抄袭计划”付诸实施了。 而腾讯迈出第一步又何尝不是“抄”来的 。“天下文章一大抄”，互相抄来抄去，中国的微信、抖音走到了世界的前列，中国的“双11”成了世界最大的网上购物节。  现在看看 ,鸿儒计划,胡锡进的微博视频
MkN0o4KKd,应旺,True,4131880,25534779,今天看了媒体报道，对于腾讯内部的大会，马化腾先生作了重要发言，并且揭开了自己的伤疤，说目前腾讯内部腐败现象比较严重，到达了触目惊心的。那么腾讯这几年的发展我们是有目共睹的，而且取得了可观的成绩，我们用的很多互联网产品APP都是来自于腾讯，但发展的好、光鲜亮丽并不一定代表着他没有问题 ,马化腾称腾讯内部贪腐问题触目惊心,应旺的微博视频
